Article,Cites,Year
"Purely flavored leptogenesisDA Sierra, E Nardi, LA Muñoz
Physical Review D 80 (1), 016007",22,2009
"Asymmetric electron angular distributions in resonant dissociative photoionization of H 2 with ultrashort XUV pulsesJF Pérez-Torres, F Morales, JL Sanz-Vicario, F Martín
Physical Review A 80 (1), 011402",30,2009
"Wavelet analyses and applicationsCC Bordeianu, RH Landau, MJ Paez
European Journal of Physics 30 (5), 1049",6,2009
"Finding the Higgs boson through supersymmetryF De Campos, OJP Eboli, MB Magro, D Restrepo, JWF Valle
Physical Review D 80 (1), 015002",10,2009
"Impurity-related polarizability and photoionization-cross section in double quantum wells under electric fields and hydrostatic pressureAL Morales, N Raigoza, E Reyes-Gómez, JM Osorio-Guillén, CA Duque
Superlattices and Microstructures 45 (6), 590-597",14,2009
"De regreso a la LunaJI Zuluaga
Agenda Cultural Alma Máter",,2009
"Surface anisotropy, hysteretic, and magnetic properties of magnetite nanoparticles: A simulation studyJ Mazo-Zuluaga, J Restrepo, F Munoz, J Mejía-López
Journal of Applied Physics 105 (12), 123907",29,2009
"Revisión del efecto Kerr magneto ópticoAJ Smith, DE Jaramillo, J Osorio
Revista mexicana de física E 55 (1), 61-69",,2009
"57Fe Mössbauer study of sol–gel synthesized Sn1− x− y Fe x Sb y O2− δ powdersK Nomura, CA Barrero, K Kuwano, Y Yamada, T Saito, E Kuzmann
Hyperfine Interactions 191 (1-3), 25-32",19,2009
"www. redalyc. orgOE Zuluaga
Revista Mexicana de Astronomía y Astrofísica 35, 174-175",,2009
"Peripheral optical errors and their change with accommodation differ between emmetropic and myopic eyesL Lundström, A Mira-Agudelo, P Artal
Journal of vision 9 (6), 17-17",53,2009
"COSTS PROJECTION FOR A NATURAL GAS ARTICULATED BUS TO BE USED IN COLOMBIA S MASSIVE TRANSPORTATION SYSTEMSJ Mantilla, H Acevedo, C Duque, C Galeano, S Carrion
DYNA 76 (157), 61-70",,2009
"Laser-dressing effects on the electron g factor in low-dimensional semiconductor systems under applied magnetic fieldsFE López, E Reyes-Gómez, HS Brandi, N Porras-Montenegro, LE Oliveira
Journal of Physics D: Applied Physics 42 (11), 115304",14,2009
"Structural properties of iron phases formed on low alloy steels immersed in sodium chloride-rich solutionsFR Pérez, CA Barrero, O Arnache, LC Sánchez, KE García, ARH Walker
Physica B: Condensed Matter 404 (8), 1347-1353",14,2009
"Measuring the density profile behind the supernova shock wave using neutrino spectroscopyAF Pérez, JI Zuluaga
Revista Mexicana de Astronomia y Astrofisica Conference Series 35, 292",,2009
"Star Formation at High Redshift Galaxies, a Semi-analytic ApproachJC Muñoz, JI Zuluaga
Revista Mexicana de Astronomia y Astrofisica Conference Series 35, 312",,2009
"Temporal dynamics of ocular aberrations: monocular vs binocular visionA Mira‐Agudelo, L Lundström, P Artal
Ophthalmic and Physiological Optics 29 (3), 256-263",19,2009
"Changes of ocular aberrations with gazeP Prado, J Arines, S Bará, S Manzanera, A Mira‐Agudelo, P Artal
Ophthalmic and Physiological Optics 29 (3), 264-271",13,2009
"Multiplexing encryption technique by combining random amplitude and phase masksJF Barrera, M Tebaldi, R Torroba, N Bolognini
Optik-International Journal for Light and Electron Optics 120 (8), 351-355",9,2009
"Ocular off-axis aberrations and refraction: A population studyL Lundstrom, J Gustafsson, A Mira-Agudelo, P Unsbo, P Artal
Investigative Ophthalmology & Visual Science 50 (13), 6162-6162",1,2009
"Peripheral Refraction and Aberrations for Different Wavelengths: Off-Axis Chromatic AberrationB Jaeken, L Lundstrom, A Mira-Agudelo, P Artal
Investigative Ophthalmology & Visual Science 50 (13), 1556-1556",,2009
"Optical Image Multiplexing Encryption Using Digital Holography in a JTC ArchitectureE Rueda, JF Barrera, R Henao, R Torroba
Digital Holography and Three-Dimensional Imaging, JTuB3",,2009
"Characterization of La2/3Ca1/3xMnO3 with Low Doping of Fe and CrD Giratá, DL Quintero, O Arnache, A Hoffmann
WOMEN IN PHYSICS: Third IUPAP International Conference on Women in Physics ...",,2009
"TiO2 Dopado con Fe Obtenido por Aleamiento MecánicoAM Calle, LC Sánchez, JD Arboleda, J Osorio, K Nomura, CA Barrero
Revista Colombiana de Física 41 (2)",,2009
"Laser Assisted Antiproton-Hydrogen Collisions.FP Valencia, JLS Vicario
Revista Colombiana de Física 41 (2)",,2009
"Perturbed Hooke’s Atom Exposed to Intense Ultrashort Laser PulsesJFP Torres, JLS Vicarioa
Revista Colombiana de Fisica 41 (2)",1,2009
"ELECTRON ANGULAR DISTRIBUTIONS IN DISSOCIATIVE PHOTOIONIZATION OF THE HYDROGEN MOLECULEJF Pérez-Torres, JL Sanz-Vicario, F Martín
Revista Colombiana de Química 38 (1), 109-116",,2009
"Estudio de la Estadíistica de la Polarización en Patrones de Speckle.CA Vargas, R Henao
Revista Colombiana de Física 41 (2)",,2009
"Digital encryption with undercover multiplexing by scaling the encoding maskJF Barrera, R Henao, M Tebaldi, R Torroba, N Bolognini
Optik-International Journal for Light and Electron Optics 120 (7), 342-346",8,2009
"Stationary Density Matrix of a Pumped Polariton SystemCA Vera, A Cabo, A González
Physical review letters 102 (12), 126404",5,2009
"Searching supersymmetry at the LHCb with displaced verticesF De Campos, OJP Eboli, MB Magro, D Restrepo
Physical Review D 79 (5), 055008",25,2009
"Aplicación de diseño óptimo dimensional a la síntesis de posición y velocidad en mecanismos de cuatro barrasCH Galeano Urueña, CA Duque Daza, DA Garzón Alvarado
Revista Facultad de Ingeniería Universidad de Antioquia, 129-144",1,2009
"Effects of hydrostatic pressure on the conduction‐electron g‐factor in GaAs–Ga1–xAlx As quantum wellsN Porras‐Montenegro, N Raigoza, E Reyes‐Gómez, CA Duque, ...
physica status solidi (b) 246 (3), 648-651",,2009
"Study of the electronic properties of GaAs‐based atomic layer doped field effect transistor (ALD‐FET) under the influence of hydrostatic pressureJC Martínez‐Orozco, I Rodríguez‐Vargas, CA Duque, ME Mora‐Ramos, ...
physica status solidi (b) 246 (3), 581-585",9,2009
"Excitons in coupled quantum dots: hydrostatic pressure and electric field effectsSY López, N Porras‐Montenegro, CA Duque
physica status solidi (b) 246 (3), 630-634",13,2009
"Hydrostatic pressure, electric and magnetic field effects on shallow donor impurity states and photoionization cross section in cylindrical GaAs–Ga1–xAlx As quantum dotsMG Barseghyan, AA Kirakosyan, CA Duque
physica status solidi (b) 246 (3), 626-629",25,2009
"Optical transition in self-assembled InAs/GaAs quantum lens under high hydrostatic pressureAH Rodríguez, C Trallero-Giner, CA Duque, GJ Vázquez
Journal of Applied Physics 105 (4), 044308",11,2009
"Photonic band structure evolution of a honeycomb lattice in the presence of an external magnetic fieldCA Duque, N Porras-Montenegro, SB Cavalcanti, LE Oliveira
Journal of Applied Physics 105 (3), 034303",17,2009
"Lateral shift multiplexing with a modified random mask in a joint transform correlator encrypting architectureE Rueda, JF Barrera, R Henao, R Torroba
Optical Engineering 48 (2), 027006-027006-6",17,2009
"Decaying dark matter can explain the e? excessesE Nardi, F Sannino, A Strumia
Journal of Cosmology and Astroparticle Physics 2009 (01), 043",190,2009
"Production of excited atomic hydrogen and deuterium from H2 and D2 photodissociationJD Bozek, JE Furst, TJ Gay, H Gould, ALD Kilcoyne, JR Machacek, ...
Journal of Physics B: Atomic, Molecular and Optical Physics 42 (2), 029801",3,2009
"Radiative seesaw model: Warm dark matter, collider signatures, and lepton flavor violating signalsDA Sierra, J Kubo, D Suematsu, D Restrepo, O Zapata
Physical Review D 79 (1), 013011",75,2009
"Análisis, Diseño e Implementación de un Sistema Adaptivo de Recomendación de Información Basado en MashupsK Mizhquero, J Barrera
Revista Tecnológica ESPOL-RTE",11,2009
"Análisis No Lineal de Series de Tiempo y su Aplicación a Potenciales Visuales Evocados ContinuosA Pertuz, BAR Rey
Revista de la Sociedad Colombiana de Física 41 (2), 420-423",,2009
"Integración Simpléctica: revisión y aplicacionesCA Vera, BAR Rey
Revista de la Sociedad Colombiana de Física 41 (2), 432-435",,2009
"Sistemas Caóticos y su Aplicación a la Encriptación de SeñalesJP Gallego, JD Sánchez, CA Vera, BAR Rey
Revista de la Sociedad Colombiana de Física 41 (2), 436-439",,2009
"Interactive optimization tool for the optimum design of helical extension springs.C Galeano, C Duque, A Tovar
Revista Técnica de la Facultad de Ingeniería. Universidad del Zulia 32 (2)",,2009
"The Tribological Characteristics of TiN, TiC, TiC/TiN Films Prepared by Reactive Pulsed Arc Evaporation TechniqueDM Devia, J Restrepo, A Ruden, JM González, F Sequeda, PJ Arango
Society of Vacuum Coaters 505, 856-7188",13,2009
"The Effect of Substrate Temperatures on Tribological Behavior of Ti-Al-N Coating Deposited by Magnetron Sputtering, RevMF Cano, JS Restrepo, A Ruden, JM González, F Sequeda
Society of Vacuum Coaters 52, 37-43",11,2009
"Aplicación del método Petrov-galerkin como técnica para la estabilización de la solución en problemas unidimensionales de convección-difusión-reacción Application of Petrov-galerkin method inDAG Alvarado, CHG Urueña, CAD Daza
Revista Facultad de Ingeniería Universidad de Antioquia, 73-90",5,2009
"Procesos Ópticos en Micropilares CircularesCAP Vargas, H Vinck-Posada, BAR Rey
Revista de la Sociedad Colombiana de Física 41 (3), 622-625",,2009
"Función de Wigner y Decoherencia Cuántica para Sistemas Átomo-Campo en Cavidades QEDJG Restrepo, H Vinck-Posada, BAR Rey
Revista de la Sociedad Colombiana de Física 41 (1), 171-174",,2009
"Implications of an additional scale on leptogenesisDA Sierra, LA Muñoz, E Nardi
Journal of Physics: Conference Series 171 (1), 012078",5,2009
"On the reaction of iron oxides and oxyhydroxides with tannic and phosphoric acid and their mixturesJJ Beltrán, FJ Novegil, KE García, CA Barrero
LACAME 2008, 133-140",,2009
"The role of the spinel phases on the rust activity in corroded steelsFR Pérez, CF Londoño, CA Barrero, KE García, J Tobón
LACAME 2008, 127-131",,2009
"Preparación y Caracterización de un FerrofluidoJ Urquijo, AL Morales, H Casanova, J Garces
Revista de la Sociedad Colombiana de Física 41 (1), 99-101",1,2009
"Relevance of Various Dirac Covariants in Hadronic Bethe-Salpeter Wave Functions in Pseudoscalar Meson DecaysS Bhatnagar, SY Li, J Mahecha
Proceedings of the International Symposium on Nuclear Physics, 516",,2009
"Análisis estructural, químico y tribológico de recubrimiento de CrN depositados sobre aceros de uso industrial con la técnica de pulverización catódica reactivaC Cuéllar, F Sequeda, A Ruden, J Restrepo
El Hombre y la Maquina, 132",1,2009
"Exchange bias en bicapas magnéticas ferro-antiferro: simulación Monte CarloP Cossio, J Restrepo
Revista de la Sociedad Colombiana de Física 41 (1), 79-81",1,2009
"Magnetic Behavior and stoichiometry on magnetite nanoparticlesJ Mazo-Zuluaga, J Restrepo, J Mejía-López
Revista de la Sociedad Colombiana de Física 41 (3), 610-612",3,2009
"Simulación Monte Carlo del Proceso de Relajación Superficial en Nanopartículas de MagnetitaJ Mazo-Zuluaga, J Restrepo, Y Labaye
Revista de la Sociedad Colombiana de Física 41 (1), 116-118",,2009
"Efecto del flujo de nitrógeno en la estructura, orientación preferencial y análisis DFT de ZrN depositado por pulverización Magnetrónica reactiva, SuplemA Ruden, JS Restrepo, M Muñoz, JM González, A Neria, F Sequeda
Revista Latinoamericana de Metalalurgia y Materiales S 1, 1009-1013",5,2009
"Filtro Holográfico AdaptadoJF Barrera, J Serna
Revista de la Sociedad Colombiana de Física 41 (1), 142-144",,2009
"Criterio Generalizado para la Distinción entre Difracción de Fraunhofer y FresnelEA Rueda, FF Medina, JF Barrera
Revista de la Sociedad Colombiana de Física 41 (1), 128-130",4,2009
"Manejo seguro de múltiples datos mediante una técnica de multiplexado de ocultamientoJF Barrera, JH Serna, M Tebaldi, N Bolognini, R Torroba
Revista de la Sociedad Colombiana de Física 41 (3), 645-647",1,2009
"Sequential and direct two-photon double ionization of D2 at FLASHYH Jiang, A Rudenko, KU Kühnel, T Ergler, S Lüdemann, K Zrost, ...
Journal of Physics: Conference Series 194 (3), 032057",,2009
"Complete Feshbach-type projection method to compute autoionizing states in Li-like atomic systemsJC Cardona, JL Sanz-Vicario, F Martín
Journal of Physics: Conference Series 194 (15), 152013",,2009
"Two-photon dissociative ionization of H2 by ultrashort xuv laser pulsesJF Pérez-Torres, JL Sanz-Vicario, H Bachau, F Martín
Journal of Physics: Conference Series 194 (3), 032054",,2009
"Accurate Computation of Resonant States of Three-Electron Atomic Systems: A Complex Scaled Hylleraas CI MethodJC Cardona, JLS Vicario, E Lindroth
Revista de la Sociedad Colombiana de Física 41 (1), 223-225",,2009
"Sequential versus nonsequential two-photon double ionization of the D2 molecule at 38 eVE Plésiat, JF Pérez-Torres, YH Jiang, A Rudenko, KU Kühnel, T Ergler, ...
Journal of Physics: Conference Series 194 (2), 022069",,2009
"Using ultrashort xuv laser pulses to investigate symmetry breaking in one-photon single-ionization of H2JF Pérez-Torres, JL Sanz-Vicario, F Martín
Journal of Physics: Conference Series 194 (3), 032041",,2009
"Computation of resonant states using explicitly correlated coordinates in Be-like atomic systemsJC Cardona, JL Sanz-Vicario
Journal of Physics: Conference Series 194 (15), 152019",1,2009
"Probing H2 autoionizing states with femto-and attosecond laser pulsesJL Sanz-Vicario, JF Pérez-Torres, F Morales, E Plessiat, F Martín
Journal of Physics: Conference Series 194 (1), 012013",,2009
"Efectos de no Parabolicidad y Anisotropía Sobre los Estados Electrónicos y el Factor g Efectivo en Hilos CuánticosFE López, BA Rodríguez, ER Gómez, LE Oliveira
Revista de la Sociedad Colombiana de Física 41 (1), 47-50",,2009
"Energía del Estado Base para un Sistema Finito de Excitones Espacialmente Indirectos en Puntos CuánticosFE López, BA Rodríguez
Revista de la Sociedad Colombiana de Física 41 (3), 572-575",,2009
"Coulomb correlations of a few body system of spatially separated chargesI Mondragon-Shem, BA Rodriguez, FE Lopez
Journal of Physics: Conference Series 193 (1), 012133",,2009
"Study of the electronic properties basic solid state physics of GaAs-based atomic layer doped field effect transistor (ALD-FET) under the influence of hydrostatic pressureJC MARTINEZ-OROZCO, I RODRIGUEZ-VARGAS, CA DUQUE, ...
Physica status solidi. B. Basic research 246 (3), 581-585",,2009
"Hydrostatic-pressure-induced Γ-X mixing in delta-doped AlxGa1-xAsME Mora-Ramos, CA Duque
Journal of Physics: Conference Series 167 (1), 012030",2,2009
"Elementos Difractivos en la Corrección de la PresbiciaR Henao, A Ciro, Z Jaroszewicz
Bistua: Revista de la Facultad de Ciencias Básicas 7 (2), 53-58",,2009
"Non-parabolicity and anisotropy effects on the conduction-electron effective g factor in GaAs–Ga1-xAlxAs quantum well wiresFE López, E Reyes-Gómez, LE Oliveira
Physica E: Low-dimensional Systems and Nanostructures 41 (2), 240-244",,2008
"Effects of hydrostatic pressure on the Coulomb-bound states in GaAs–Ga 1− x Al x As semiconductor superlatticesJ Vargas, N Raigoza, AL Morales, CA Duque, E Reyes-Gómez
Superlattices and Microstructures 44 (6), 809-813",1,2008
"Synchronized chaotic phase masks for encrypting and decrypting imagesE Rueda, CA Vera, B Rodríguez, R Torroba
Optics communications 281 (23), 5750-5755",5,2008
"Mixtures of iron and anatase TiO 2 by mechanical alloyingAM Calle, LC Sanchez, JD Arboleda, JJ Beltran, CA Barrero, J Osorio, ...
Microelectronics Journal 39 (11), 1322-1323",5,2008
"Fe-doped SnO 2 obtained by mechanical alloyingLC Sánchez, AM Calle, JD Arboleda, J Osorio, K Nomura, CA Barrero
Microelectronics Journal 39 (11), 1320-1321",6,2008
"Physical properties in thin films of iron oxidesJD Uribe, J Osorio, CA Barrero, D Girata, AL Morales, A Hoffmann
Microelectronics Journal 39 (11), 1391-1393",9,2008
"Electron Landé g∥ factor in semiconductor quantum wiresFE López, E Reyes-Gómez, LE Oliveira
Microelectronics Journal 39 (11), 1272-1273",,2008
"Wigner function and decoherence in a microcavity-Qdot systemJP Restrepo, H Vinck-Posada, BA Rodríguez
Microelectronics Journal 39 (11), 1360-1362",,2008
"Hydrostatic pressure effects on the binding and transition energies for Wannier excitons in GaAs/Ga1-xAlxAs quantum wellsP Aristizábal, RL Restrepo, W Ospina, CA Duque
Microelectronics Journal 39 (11), 1261-1263",2,2008
"119Sn Mossbauer study of sol? gel synthetized Fe x Sb y Sn1-x -y O2-delta powdersK Nomura, E Kuzmann, CA Barrero, S Stichleutner, Z Homonnay
Hyperfine Interactions 184 (1-3), 57-62",11,2008
"Band-edge states of the zeroth-order gap in quasi-periodic photonic superlatticesA Bruno-Alfonso, E Reyes-Gómez, SB Cavalcanti, LE Oliveira
Photonics, Devices, and Systems IV, 71381A-71381A-5",1,2008
"Outer-shell photodetachment of the metastable Mg−[core] 3 s 3 p 2 and Ca−[core] 4 s 4 p 2 P e 4 statesJL Sanz-Vicario, JC Cardona, E Lindroth
Physical Review A 78 (5), 053411",2,2008
"A 2D honeycomb photonic crystal under applied magnetic fieldsCA Duque, N Porras-Montenegro, SB Cavalcanti, LE Oliveira
Photonics, Devices, and Systems IV, 713819-713819-5",,2008
"Characterization of akaganeite synthesized in presence of Al 3+, Cr 3+, and Cu 2+ ions and ureaKE García, CA Barrero, AL Morales, JM Greneche
Materials Chemistry and Physics 112 (1), 120-126",16,2008
"Quantum dot dipole orientation and excitation efficiency of micropillar modesAG Silva, CA Parra-Murillo, PT Valentim, JS Morais, F Plentz, ...
Optics express 16 (23), 19201-19207",7,2008
"Effects of hydrostatic pressure on the electron factor and g-factor anisotropy in GaAs–(Ga, Al) As quantum wells under magnetic fieldsN Porras-Montenegro, CA Duque, E Reyes-Gómez, LE Oliveira
Journal of Physics: Condensed Matter 20 (46), 465220",4,2008
"Determination of the IMF in the LMC Stellar Cluster NGC 2156E Silva-Villa, M Sirianni, J Zuluaga
Revista mexicana de astronomía y astrofísica 44 (1), 57-70",2,2008
"Flavor changing neutral currents with a fourth family of quarksJA Herrera, RH Benavides, WA Ponce
Physical Review D 78 (7), 073008",25,2008
"Ly-alpha and H-alpha Optical Excitation Functions Resulting From Photodissociation of H2 and D2TJ Gay, E Litaker, JR Machacek, JE Furst, ALD Kilcoyne, F Martin, ...
APS Meeting Abstracts 1, 2006",,2008
"LeptogenesisS Davidson, E Nardi, Y Nir
Physics Reports 466 (4), 105-177",480,2008
"Electronic structure of a thermoelectric material: CsBi 4 Te 6W Luo, JS De Almeida, JM Osorio-Guillen, R Ahuja
Journal of Physics and Chemistry of Solids 69 (9), 2274-2276",2,2008
"Band edge states of the⟨ n⟩= 0 gap of Fibonacci photonic latticesA Bruno-Alfonso, E Reyes-Gómez, SB Cavalcanti, LE Oliveira
Physical Review A 78 (3), 035801",30,2008
"Observaciones sobre la larva del cangrejo marino tropical (Decapoda: Porcellanidae) Petrolisthes armatus en el Golfo de Nicoya, Costa RicaE Díaz-Ferguson, D Arroyo, A Morales, JA Vargas
Revista de biología tropical 56 (3), 1209-1223",2,2008
"ROLE OF VARIOUS DIRAC COVARIANTS IN BS WAVE FUNCTIONS IN DECAY CONSTANT CALCULATIONS OF PSEUDOSCALAR MESONS USING A POWER COUNTING SCHEMES Bhatnagar, J Mahecha
Abdus Salam International Centre for Theoretical Physics",,2008
"Collider aspects of flavor physics at high QT Lari, L Pape, W Porod, JA Aguilar-Saavedra, BC Allanach, G Burdman, ...
The European Physical Journal C 57 (1-2), 183-307",91,2008
"Fermion mass hierarchy and nonhierarchical mass ratios in S U (5)× U (1) FLF Duque, DA Gutierrez, E Nardi, J Norena
Physical Review D 78 (3), 035003",10,2008
"Novel Higgs decay signals in R-parity violating modelsDA Sierra, W Porod, D Restrepo, CE Yaguna
Physical Review D 78 (1), 015015",13,2008
"Electron Landé g factor in GaAs–(Ga, Al) As quantum wells under applied magnetic fields: Effects of Dresselhaus spin splittingE Reyes-Gómez, N Porras-Montenegro, CA Perdomo-Leiva, HS Brandi, ...
Journal of Applied Physics 104 (2), 023704",15,2008
"Decoherencia y Entrelazamiento en un Sistema Tri-partito: Interacción de un Átomo con Dos Cavidades QED Disipativas.E Agudelo, KM Fonseca, BA Rodríguez
Revista Colombiana de Física 40 (2)",,2008
"Reconstrucción de la Dinámica en el Circuito de Chua.A Martínez, BA Rodríguez
Revista Colombiana de Física 40 (2)",,2008
"Efectos del Dopaje de 57 Fe en las Propiedades Estructurales y Magnéticas de Películas Delgadas de Manganitas La 2/3 Ca 1/3 Mn 1-y Fe y O 3 (y= 0, 0.01 y 0.03).O Arnache, A Hoffmann, D Giratá
Revista Colombiana de Física 40 (2)",,2008
"Micropillar resonator in a magnetic field: Zero and finite temperature casesH Vinck-Posada, BA Rodriguez, A Gonzalez
Superlattices and Microstructures 43 (5), 500-506",2,2008
"Fe-doping and strain effects on structural and magnetotransport properties in La 2/3 Ca 1/3 Mn 1− y Fe y O 3 thin filmsO Arnache, D Giratá, A Hoffmann
Physical Review B 77 (21), 214430",2,2008
"Effect of surface anisotropy on the magnetic properties of magnetite nanoparticles: A Heisenberg–Monte Carlo studyJ Mazo-Zuluaga, J Restrepo, J Mejía-López
Journal of Applied Physics 103 (11), 113906",23,2008
"Probing bilinear R-parity violating supergravity at the LHCF De Campos, OJP Eboli, MB Magro, W Porod, D Restrepo, M Hirsch, ...
Journal of High Energy Physics 2008 (05), 048",64,2008
"Effect of Fe doping on structural and magnetic properties of La 2/3 Ca 1/3 Mn 1− yFeyO 3 (y= 0–0.03) thin filmsO Arnache, A Hoffmann, D Giratá
Microelectronics Journal 39 (3), 544-547",3,2008
"Effect of the Dresselhaus spin splitting on the effective Landé g-factor in GaAs–(Ga, Al) As quantum wells under in-plane or growth-direction magnetic fieldsN Porras-Monenegro, CA Perdomo-Leiva, E Reyes-Gómez, HS Brandi, ...
Microelectronics Journal 39 (3), 390-393",,2008
"Magnetoexciton states and diamagnetic shifts in GaAs-Ga1-xAlxAs quantum dots/ultrathin quantum wells under growth-direction magnetic fieldsZ Barticevic, M Pacheco, CA Duque, LE Oliveira
Microelectronics Journal 39 (3), 348-350",1,2008
"Exciton diamagnetic shift in GaAs/Ga1-xAlxAs quantum wells under in-plane magnetic fieldsCA Duque, M de Dios-Leyva, LE Oliveira
Microelectronics Journal 39 (3), 407-410",1,2008
"Influence of the hydrostatic pressure onto the electronic and transport properties of n-type double δ-doped GaAs quantum wellsI Rodriguez-Vargas, ME Mora-Ramos, CA Duque
Microelectronics Journal 39 (3), 438-441",3,2008
"Direct and indirect exciton states in GaAs-(Ga, Al) As double quantum wells under crossed electric and magnetic fieldsLE Oliveira, M de Dios-Leyva, CA Duque
Microelectronics Journal 39 (3), 398-401",4,2008
"Energy states in GaAs delta-doped field effect transistors under hydrostatic pressureJC Martínez-Orozco, I Rodríguez-Vargas, ME Mora-Ramos, CA Duque
Microelectronics Journal 39 (3), 648-650",10,2008
"Effects of hydrostatic pressure and crossed electric and magnetic fields on shallow-donor states in GaAs/Ga1-xAlxAs quantum wellsE Tangarife, SY Lopez, M de Dios-Leyva, LE Oliveira, CA Duque
Microelectronics Journal 39 (3), 431-434",13,2008
"Optimized characterization for a spatial light modulator under less restrictive operating conditionsC Dorbesi, E Rueda, M Tebaldi, R Torroba, N Bolognini
RIAO/OPTILAS 2007: 6th Ibero‐American Conference on Optics (RIAO); 9th Latin ...",,2008
"Influence of non-stoichiometry on the magnetic properties of magnetite nanoparticlesJ Mazo-Zuluaga, J Restrepo, J Mejía-López
Journal of Physics: Condensed Matter 20 (19), 195213",16,2008
"The electron g factor of cylindrical GaAs–Ga1− xAlxAs quantum well wires under magnetic fields applied along the wire axisFE López, BA Rodríguez, E Reyes-Gómez, LE Oliveira
Journal of Physics: Condensed Matter 20 (17), 175204",14,2008
"Evolución Númerica de Sistemas de N Cuerpos Usando Métodos Jerárquicos de Árbol e Integración Simpléctica.CA Vera, BA Rodríguez
Revista Colombiana de Física 40 (1)",1,2008
"Síntesis y Caracterización Estructural y Magnética de Manganitas La 2/3 Ca 1/3 MnO 3 dopadas con 57 Fe.O Arnache, A Hoffmann, D Giratá
Revista Colombiana de Física 40 (1)",1,2008
"Reflectividad DRX y Propiedades Magnéticas de Películas Delgadas de Hematita α--Fe 2 O 3.JD Uribe, J Osorio, O Arnache, D Giratá, A Hoffmann
Revista Colombiana de Física 40 (1)",3,2008
"Fe-doped TiO2 prepared by mechanical alloyingLC Sánchez, AM Calle, JD Arboleda, JJ Beltran, CA Barrero, J Osorio, ...
Hyperfine Interactions 183 (1-3), 117-122",3,2008
"Structural and vibrational characteristics of magnetite as a corrosion productFR Pérez, CA Barrero, KE García, AH Walker, J Tobón, F Londoño
Revista Colombiana de Física 40 (1), 126",3,2008
"Γ-X mixing in GaAs-Ga1-xAlxAs quantum wells under hydrostatic pressureME Mora-Ramos, SY López, CA Duque
The European Physical Journal B 62 (3), 257-261",17,2008
"Lost iron and iron converted into rust in steels submitted to dry–wet corrosion processKE García, CA Barrero, AL Morales, JM Greneche
Corrosion Science 50 (3), 763-772",29,2008
"Effect of the Rashba and Dresselhaus spin-splitting terms on the electron g factor in semiconductor quantum wells under applied magnetic fieldsA Bruno-Alfonso, N Porras-Montenegro, E Reyes-Gómez, LE Oliveira
Physica E: Low-dimensional Systems and Nanostructures 40 (5), 1464-1466",1,2008
"Tilted electric-field and hydrostatic pressure effects on donor impurity states in cylindrical GaAs quantum disksSY López, N Porras-Montenegro, E Tangarife, CA Duque
Physica E: Low-dimensional Systems and Nanostructures 40 (5), 1383-1385",14,2008
