Article,Cites,Year
"Abdel-Baki, M., F. El-Diasty and FAA Wahab, Optical characterization of xTiO2–(60) x) SiO2–40Na2O glasses: II. Absorption edge, Fermi level, electronic polarizability and optical basicity 261 (2006) 65 Agrawal, GP, see Ponomarenko, SA 261 (2006) 1 Allakhverdiev, KR, T. Baykara, S. Joosten, E. Günay, AA Kaya, A. Kulibekov (Gulubayov), A. Seilmeier and E. Yu. Salaev, Anisotropy of two-photon absorption in gallium selenide at 1064 nm 261 (2006) 60JF Barrera, R Henao, M Tebaldi, R Torroba, N Bolognini
Optics Communications 261, 383-388",,2006
"Dependencia de la respuesta óptica con el decapado químico de películas de ga1-xinxasysb1-yL Tirado-Mejía, J Osorio, J Segura, C Ortiz, NJ Gutiérrez, M De los Rios, ...
Revista Colombiana de Física 38 (1), 69",,2006
"CARACTERIZACIÓN DOSIMÉTRICA DE LOS DETECTORES DIGITALES DE RADIACIÓN DMC 2000 X.J Osorio, M Plazas, D Paul, H Olaya
Revista Colombiana de Física 38 (1)",1,2006
"Síntesis y caracterización de manganita La067Ca0. 33Mn3-aO Arnache, J Urquijo, FJ Molina, M Pérez, F Mondragón, D Giratá
Revista Colombiana de Física 38 (2), 449-452",7,2006
"SERIES EDITORIAL BOARD AND OTHER COMMITTEESCJS Salinas, OP Ravinez, RO Jimenez, T Dova, D Harari, J Anjos, ...
Proceedings of the Fifth Latin American Symposium, High Energy Physics, Lima ...",,2006
"RESONANCIA FESHBACH EN LA COLISIÓN DE ÁTOMOS DE HIDRÓGENO.BE Londono, JE Mahecha
Revista Colombiana de Física 38 (1)",,2006
"Sensibilidad al desenfoque en sistemas con placas zonales hiperbólicas equilateralesE Rueda, J Serna, A Mira
Revista Colombiana de Física 38 (1)",,2006
"Local structural order in nanostructured hematiteJM Florez, J Mazo-Zuluaga, J Restrepo
ICAME 2005, 253-259",3,2006
"Estudio monte carlo del comportamiento magnético e histerético de la magnetitaJ Mazo-Zuluaga, J Restrepo
REVISTA COLOMBIANA DE FÍSICA 38 (4), 1539",,2006
"Enhanced binomial method for hyperfine field distributions of the mechanically alloyed Fe-Si systemHS Sthepa, J Restrepo, M Fajardo, GAP Alcázar, R Rodriguez
Revista Colombiana de Física 38 (4), 1563",,2006
"Semiconductors II: Surfaces, interfaces, microstructures, and related topics-Self-similarity and anti-self-similarity of the effective Lande g (bottom) factor in GaAs-(Ga, Al) AsE Reyes-Gomez, CA Perdomo-Leiva, M Dios-Leyva, LE Oliveira
Physical Review-Section B-Condensed Matter 74 (3), 33314-33400",,2006
"Semiconductors II: Surfaces, interfaces, microstructures, and related topics-Effects of non-parabolicity and in-plane magnetic fields on the cyclotron effective mass and g (bottom)-factor inM Dios-Leyva, E Reyes-Gomez, CA Perdomo-Leiva, LE Oliveira
Physical Review-Section B-Condensed Matter 73 (8), 85316-85316",,2006
"Semiconductors II: Surfaces, interfaces, microstructures, and related topics-Structural stability of (Ga, Mn) As from first principles: Random alloys, ordered compounds, and superlatticesJ Osorio-Guillen, YJ Zhao, SV Barabash, A Zunger
Physical Review-Section B-Condensed Matter 74 (3), 35305-35305",,2006
"RAPID COMMUNICATIONS-Semiconductors II: Surfaces, interfaces, microstructures, and related topics-Enhancement of interactions between magnetic ions in semiconductors due to declusteringA Franceschetti, SV Barabash, J Osorio-Guillen, A Zunger, M Schilfgaarde
Physical Review-Section B-Condensed Matter 74 (24), 241303R",,2006
"Condensed Matter: Electronic Properties, etc.-Magnetism without Magnetic Ions: Percolation, Exchange, and Formation Energies of Magnetism-Promoting Intrinsic Defects in CaOJ Osorio-Guillen, S Lany, SV Barabash, A Zunger
Physical Review Letters 96 (10), 107203-107400",,2006
"Production of excited atomic hydrogen and deuterium from H₂ and D₂ photodissociation| NOVA. The University of Newcastle's Digital RepositoryJD Bozek, JE Furst, TJ Gay, H Gould, ALD Kilcoyne, JR Machacek, ...
Institute of Physics (IOP) Publishing",,2006
"Electric field effects on the shallow donor impurity states in GaAs-(Ga, Al) As quantum-well wiresJW González
Revista Colombiana de Física 38 (1), 41",,2006
"Prueba de ronchi para un espejo concavoG de Optica Aplicada
REVISTA COLOMBIANA DE FÍSICA 38 (2), 601",,2006
"Constraints on neutrino masses from a galactic supernova neutrino signal at present and future detectorsE Nardi, JI Zuluaga
Nuclear Physics B 731 (1), 140-163",9,2005
"Fault tolerances using toroidal zone plate encryptionJF Barrera, R Henao, R Torroba
Optics communications 256 (4), 489-494",11,2005
"Study of core collapse neutrino signals and constraints on neutrino masses from a future Galactic SupernovaJI Zuluaga
arXiv preprint astro-ph/0511771",,2005
"Dark matter from the scalar sector of 3-3-1 models without exotic electric chargesS Filippi, WA Ponce, LA Sánchez
EPL (Europhysics Letters) 73 (1), 142",32,2005
"Quark masses without Yukawa hierarchiesH Fanchiotti, C Garcia-Canal, WA Ponce
EPL (Europhysics Letters) 72 (5), 733",9,2005
"Microwave studies of thin manganite films on SrTiO3 substrateM Golosovsky, M Abu-Teir, D Davidov, O Arnache, P Monod, N Bontemps, ...
Journal of applied physics 98 (8), 084902-084902",5,2005
"Effects of hydrostatic pressure and applied electric fields on the exciton states in GaAs–(Ga, Al) As quantum wellsN Raigoza, CA Duque, E Reyes-Gómez, LE Oliveira
Physica B: Condensed Matter 367 (1), 267-274",20,2005
"Simulation of nitrogen adsorption–desorption isotherms. Hysteresis as an effect of pore connectivityA Ramírez, L Sierra, M Mesa, J Restrepo
Chemical engineering science 60 (17), 4702-4708",9,2005
"Optical encryption by means of the Talbot array illuminatorJF Barrera, R Henao, Z Jaroszewicz, A Kolodziejczyk
Congress on Optics and Optoelectronics, 59540I-59540I-6",,2005
"Minute details detection through Fresnel diffraction domainJ Garcia-Sucerquia, FF Medina, JF Barrera
Optics communications 253 (4), 250-256",4,2005
"Talbot effect for the periodical object limited by a finite apertureJF Barrera, R Henao, A Kolodziejczyk, Z Jaroszewicz
14th Slovak-Czech-Polish Optical Conference on Wave and Quantum Aspects of ...",,2005
"Semi‐classical calculation of resonant states of a charged particle interacting with a metallic surfaceJJ Zuluaga, J Mahecha, E Chulkov
physica status solidi (b) 242 (10), 2010-2021",,2005
"Magnetic properties of magnetite above the Verwey transition: a Monte Carlo simulationJ Mazo‐Zuluaga, J Restrepo
physica status solidi (c) 2 (10), 3540-3543",3,2005
"Tunneling and ferroelectric properties of SRO/PZT/Pt capacitor structuresE Delgado, A Cortes, W Lopera, J Osorio, P Prieto
physica status solidi (b) 242 (9), 1902-1905",4,2005
"Effects of applied magnetic fields on direct and indirect excitons in coupled semiconductor quantum wellsE Reyes‐Gómez, LE Oliveira, M de Dios‐Leyva
physica status solidi (b) 242 (9), 1829-1832",,2005
"Hierarchical radiative masses in a supersymmetric three-family model without higgsinosLA Sánchez, WA Ponce, JM Mira
The European Physical Journal C-Particles and Fields 42 (2), 205-215",6,2005
"Electron-hole transitions in self-assembled InAs/GaAs quantum dots: Effects of applied magnetic fields and hydrostatic pressureCA Duque, N Porras-Montenegro, Z Barticevic, M Pacheco, LE Oliveira
Microelectronics Journal 36 (3), 231-233",37,2005
"Effects of hydrostatic pressure on donor states in symmetrical GaAs–Ga 0.7 Al 0.3 As double quantum wellsN Raigoza, AL Morales, CA Duque
Physica B: Condensed Matter 363 (1), 262-270",25,2005
"Semi-classical propagation and spectral analysis in the H-ion interacting with a metallic surfaceJJ Zuluaga, J Mahecha, E Chulkov
Journal of Theoretical and Computational Chemistry 4 (02), 357-372",,2005
"Mean-field dynamics of a quantum dot-microcavity systemH Vinck-Posada, BA Rodriguez, A Gonzalez
Physica E: Low-dimensional Systems and Nanostructures 27 (4), 427-438",6,2005
"Hydrostatic pressure effects on donor-related absorption spectra in GaAs–Ga 1− xAlxAs quantum wellsSY López, N Porras-Montenegro, CA Duque
Physica B: Condensed Matter 362 (1), 41-49",20,2005
"Magnetic properties of ball milled Cu 70 Fe 15 Mn 15J Restrepo, JM Grenèche, A Hernando, P Crespo, MA García, ...
Journal of magnetism and magnetic materials 290, 602-605",8,2005
"Design and Construction of an Autonomous Low‐Cost Pulse Height Analyzer and a Single Channel Analyzer for Mössbauer SpectroscopyAA Velásquez, JR Gancedo, JM Trujillo, AL Morales, JE Tobón, L Reyes
INDUSTRIAL APPLICATIONS OF THE MOSSBAUER EFFECT: International Symposium on ...",1,2005
"Quasi-bound states and intra-band transition energies in GaAs–(Ga, Al) As variably spaced semiconductor superlatticesE Reyes-Gómez, LE Oliveira, M de Dios-Leyva
Physica B: Condensed Matter 358 (1), 269-278",11,2005
"Talbot effect for periodical objects limited by finite apertures: a new interpretationJF Barrera, R Henao, Z Jaroszewicz, A Kolodziejczyk
Optik-International Journal for Light and Electron Optics 116 (3), 144-148",4,2005
"Collider signals of gravitino dark matter in bilinearly broken R-parityM Hirsch, W Porod, D Restrepo
Journal of High Energy Physics 2005 (03), 062",51,2005
"Probing neutrino mass with displaced vertices at the Fermilab TevatronF De Campos, OJP Eboli, MB Magro, W Porod, D Restrepo, JWF Valle
Physical Review D 71 (7), 075001",38,2005
"Optical encryption method using toroidal zone platesJF Barrera, R Henao, R Torroba
Optics communications 248 (1), 35-40",18,2005
"Effects of Coulomb interactions on the splitting of luminescence linesBA Rodriguez, A Gonzalez
Physica E: Low-dimensional Systems and Nanostructures 27 (1), 129-139",2,2005
"Electrical and structural properties of Ce 0.9 CoFe 3 Sb 12 thermoelectric thin filmsO Arnache, D Girata, F Perez, LF Castro, P Prieto, W Lopera
Solid state communications 133 (5), 343-346",11,2005
"Magnetic properties and critical behavior of random α− Fe Mn Al alloys: An Ising Monte Carlo studyJ Restrepo, JM Greneche
Physical Review B 71 (6), 064406",16,2005
"Equilateral hyperbolic moiré zone plates with variable focus obtained by rotationsZ Jaroszewicz, A Kołodziejczyk, A Mira, R Henao, S Bará
Optics express 13 (3), 918-925",7,2005
"Design and construction of an autonomous control system for Mössbauer SpectrometryAA Velásquez, JM Trujillo, AL Morales, JE Tobon, L Reyes, JR Gancedo
Hyperfine interactions 161 (1-4), 139-145",4,2005
"Ferrimagnetic to paramagnetic transition in magnetite: Mössbauer versus monte carloJM Florez, J Mazo-Zuluaga, J Restrepo
Hyperfine interactions 161 (1-4), 161-169",9,2005
"Magnetic-field effects on quasi-two-dimensional excitons in coupled Ga As‐(Ga, Al) As quantum wellsE Reyes-Gómez, LE Oliveira, M de Dios-Leyva
Physical Review B 71 (4), 045316",16,2005
"Diseño y construcción de un sistema espectroscópico controlado con LabVIEWFR Pérez, L Reyes, J López, J Tobón, A Velásquez
Rev. Acad. Col. Cien. Exact. Fís. Nat., Vol Mem IX Encuentro Nacional de ...",1,2005
"Medidas de índice de refracción de semiconductores ternarios InGaAs e InAlAsAL Morales, JE Hamann, CA Barrero, GM Da Costa, G Pérez
Revista de la Sociedad Colombiana de Física 37 (1), 30-33",,2005
"Hernandez T., 113 Imbellone PA, 43 Khasanov AM, 83 Larrea JJ, 237FJ Litterst, CA Barrero, JF Bengoa, AA Bisschoff, MC Brink, SV Bhoraskar, ...
Hyperfine Interactions 161, 247-248",,2005
"CAOS EN EL ATOMO DE HIDROGENO BIDIMENSIONAL INMERSO EN UN CAMPO MAGNÉTICOEA Gómez11, BAR Rey
REVISTA COLOMBIANA DE FÍSICA 37 (1)",,2005
"Análisis de las concentraciones de In y As en la superficie de películas de GaInAsSb fabricadas por epitaxia en fase líquidaL Tirado-Mejía, J Segura, J Osorio, J Gómez, C Vargas, H Ariza-Calderón
REVISTA COLOMBIANA DE FÍSICA 37 (1), 38",,2005
"Ahn, JT, see Park, S. 256 (2005) 108 Baek, Y.-S., see Lee, J.-M. 256 (2005) 78 Baek, Y.-S., see Park, S. 256 (2005) 108 Bagayev, SN, see Okhapkin, MV 256 (2005) 347FI Baida, Y Poujet, B Guizal, D Van Labeke, JF Barrera, R Henao, ...
Optics Communications 256, 507-514",,2005
"Estimación del factor giromagnético en películas delgadas de La0. 67Ca0. 33MnO3 por medio de espectroscopia de resonancia electrónica de espinesO Arnache, P Monod, D Giratá, P Prieto
REVISTA COLOMBIANA DE FÍSICA 37 (1), 266",,2005
"Respuesta radiación infrarroja y visible de pelìculas delgadas de Bi2Sr2CaC2O8+ dW Lopera, D Giratá, AF Santander-Syro, N Bontemps, R Lobo
Revista de la Sociedad Colombiana de Física 37 (1), 146-149",,2005
"Magnetización en películas delgadas de La0. 67Ca0. 33MnO3: un estudio por medio de ESR y SQUIDD Giratá, P Monod, P Prieto, O Arnache
Revista de la Sociedad Colombiana de Física 37 (1), 154-157",,2005
"Study of core collapse neutrino signals and constraints on neutrino masses from a future galactic supernovaJorge I. Zuluaga T., E Nardi",,2005
"Acción de los convertidores de herrumbre en óxidos de hierroFJ Novegil-Anleo, JJ Beltrán, J Minotas, KE García, AL Morales, G Pérez, ...
Revista de la Sociedad Colombiana de Física 37 (1), 203-206",1,2005
"Comportamiento de óxihidroxidos de hierro en soluciones que contienen acidos tánico y fosfóricoJJ Beltrána, FJ Novegil-Anleob, J Minotasb, KE Garcíab, AL Morales, ...
REVISTA COLOMBIANA DE FÍSICA 37 (1), 211",,2005
"On the rust products formed on weathering and carbon steels exposed to chloride in dry-wet cyclical processesKE García, AL Morales, CA Barrero, JM Greneche
LACAME 2004, 127-137",5,2005
"Critical behavior of magnetite: a mössbauer and Monte Carlo studyJM Florez, J Mazo-Zuluaga, J Restrepo
REVISTA COLOMBIANA DE FÍSICA 37 (2), 378",1,2005
"Hyperfine and structural properties of the goethite to hematite mechanochemical transformationJE Hamann, J Restrepo
Revista de la Sociedad Colombiana de Física 37 (2), 367-372",,2005
"Semiconductors II: Surfaces, interfaces, microstructures, and related topics-Magnetic-field effects on quasi-two-dimensional excitons in coupled GaAs-(Ga, Al) As quantum wellsE Reyes-Gomez, LE Oliveira, M Dios-Leyva
Physical Review-Section B-Condensed Matter 71 (4), 45316-45316",,2005
"Resonances in few-body systemsE Lindroth, GF Gribakin, JL Sanz-Vicario, J Wallenius
EUROPHYSICS CONFERENCE ABSTRACTS ECA 29 (I), p213",,2005
"Busca de massa de neutrinos com vértices deslocados no TevatronFLC Carvalho, OJP Éboli, MB Magro, W Porod, D Restrepo, JWF Valle
Physical Review D 71 (7), 075001",,2005
"Absorción óptica relativa a impurezas donadoras en pozos cuánticos de GaAs-(Ga, Al) As bajo efectos de presión hidrostáticaN Porras-Montenegro, CA Duque, SY López
Revista de la Sociedad Colombiana de Física 37 (1), 130-133",,2005
"Sección de cruce de fotoionización en hilos cuánticos de GaAs-(Ga, Al) As: efectos de presión hidrostáticaJD Correa, O Cepeda-Giraldo, N Porras-Montenegro, CA Duque
REVISTA COLOMBIANA DE FÍSICA 37 (1), 179",,2005
"Análisis del regeneramiento óseo bajo el esquema de optimización topológicaDA Garzón, MA Roa, CA Duque
Ingeniería e Investigación 25 (1), 22-29",2,2005
"Flavor Studies on Some Amazonian Fruits 1. Free and Bound Volatles of Cocona (Solanum sessiliflorum Dunal) Pulp FruitA Fajardo, AL Morales, C Duque
SPECIAL PUBLICATION-ROYAL SOCIETY OF CHEMISTRY 300 (1), 156-163",1,2005
"Energía de enlace para una impureza donadora poco profunda en hilos cuánticos rectangulares de GaAs bajo presión hidrostáticaJC Vásquez, A Montes, AL Morales, CA Duque
REVISTA COLOMBIANA DE FÍSICA 37 (1), 34",,2005
"Efectos de la presión hidrostática sobre la recombinación electrón-hueco en pozos cuánticos de GaAs-(Ga, Al) AsGP Sierra, CA Duque, O Cepeda-Giraldo, JG Bedoya, M Lara-Quintero
Revista de la Sociedad Colombiana de Física 37 (1), 183-186",,2005
"Láser de fibra óptica en anillo: Modelo basado en parámetros de transmisiónJ Gómez, P Torres, VH Aristizabal, FJ Vélez, P Torres, ...
Memorias IX Encuentro Nacional de Óptica, Medellín",2,2005
"Montaje y calibración de un sistema de efecto Kerr magnetoópticoJ López, L Reyes, J Tobón, R Henao, M Grimsditch, AL Morales, J Osorio
Revista colombiana de Física 37 (2), 384-388",8,2005
"Ni-and Zn-doped hematite obtained by combustion of mixed metal oxinatesCA Barrero, J Arpe, E Sileo, LC Sanchez, R Zysler, C Saragovi
Physica B: Condensed Matter 354 (1), 27-34",22,2004
"Magnetic and crystal structure refinement in akaganeite nanoparticleKE Garcia, AL Morales, CA Barrero, CE Arroyave, JM Greneche
Physica B: Condensed Matter 354 (1), 187-190",22,2004
"Finite size effects and spin transition in ball-milled γ-(FeMn) 30 Cu 70 nanostructured alloysJ Restrepo, JM Greneche, JM González
Physica B: Condensed Matter 354 (1), 174-182",4,2004
"Monte Carlo study of the bulk magnetic properties of magnetiteJ Mazo-Zuluaga, J Restrepo
Physica B: Condensed Matter 354 (1), 20-26",11,2004
"Supernova Neutrinos and the absolute scale of neutrino masses-a Bayesian approachE Nardi
arXiv preprint hep-ph/0412024",,2004
"Changes in the structural and magnetic properties of Ni–substituted hematite prepared from metal oxinatesC Saragovi, J Arpe, E Sileo, R Zysler, LC Sanchez, CA Barrero
Physics and chemistry of minerals 31 (9), 625-632",17,2004
"Fractal supersymmetric QM, geometric probability and the Riemann hypothesisC Castro, J Mahecha
International Journal of Geometric Methods in Modern Physics 1 (06), 751-793",6,2004
"Hyperfine and Structural Properties of the Mechanically Alloyed (FeMn) 30Cu70 SystemJ Restrepo, JM Grenèche
Hyperfine interactions 156 (1-4), 69-73",,2004
"Theoretical study of the effect of applied stress on the binding energy of a donor impurity in GaAs quantum well dot within an infinite potential barrierHO Oyoko, C Duque, N Porras-Montenegro
Indian Journal of Pure and Applied Physics 42 (12), 908-911",,2004
"Symmetric and asymmetric GaAs/Al0. 3Ga0. 7As double quantum well subjected to hydrostatic pressure and applied electric fieldAL Morales, N Raigoza, A Montes, N Porras‐Montenegro, CA Duque
physica status solidi (b) 241 (14), 3224-3230",6,2004
"Hydrostatic pressure effects on the donor impurity‐related photoionization cross‐section in cylindrical‐shaped GaAs/GaAlAs quantum well wiresJD Correa, O Cepeda‐Giraldo, N Porras‐Montenegro, CA Duque
physica status solidi (b) 241 (14), 3311-3317",23,2004
"Analysis of vibrations in a plate using interferometric methodsE Rueda, L Angel, DV Prieto
5th Iberoamerican Meeting on Optics and 8th Latin American Meeting on Optics ...",,2004
"Distinguishing fine details by Fresnel domain diffractionFF Medina-Estrada, JF Barrera, JI Garcia-Sucerquia
5th Iberoamerican Meeting on Optics and 8th Latin American Meeting on Optics ...",,2004
"Varifocal zone plates obtained by moireRH Henao, A Mira, Z Jaroszewicz, A Kolodziejczyk
5th Iberoamerican Meeting on Optics and 8th Latin American Meeting on Optics ...",,2004
"Interference and diffraction effects generated by multiple aperturesO Quintero, JF Barrera, RH Henao, FF Medina-Estrada
5th Iberoamerican Meeting on Optics and 8th Latin American Meeting on Optics ...",,2004
"Optical encryption method using zone platesJF Barrera, RH Henao, RD Torroba
5th Iberoamerican Meeting on Optics and 8th Latin American Meeting on Optics ...",1,2004
"In-plane electrodynamics of the superconductivity in Bi 2 Sr 2 Ca Cu 2 O 8+ δ: Energy scales and spectral weight distributionAF Santander-Syro, R Lobo, N Bontemps, W Lopera, D Girata, ...
Physical Review B 70 (13), 134504",61,2004
"Double charge exchange on medium mass nucleiH Wu, WR Gibbs
Brazilian journal of physics 34 (3A), 808",,2004
"Pseudo-SU (4) model and beta decay of pf-shell nucleiJP Valencia, HC Wu
Brazilian journal of physics 34 (3A), 837-840",6,2004
"Exciton mixing and internal transitions of neutral magnetoexcitons in quantum wellsCA Duque, Z Barticevic, M Pacheco, LE Oliveira
physica status solidi (b) 241 (10), 2434-2439",1,2004
"Donor‐related photoionization cross‐section of GaAs–(Ga, Al) As quantum dots: hydrostatic pressure effectsJD Correa, N Porras‐Montenegro, CA Duque
physica status solidi (b) 241 (10), 2440-2443",18,2004
"Stokes Parameters Description for the Contrast Variations Observed in Fringes Generated by Digital Speckle CorrelationR Henao, JF Barrera, R Torroba
Journal of Holography and Speckle 1 (2), 85-89",,2004
"SU (3) _c\ otimes SU (4) _ {\ mathrm {L}}\ otimes U (1) _X model for three familiesLA Sanchez, FA Pérez, WA Ponce
The European Physical Journal C-Particles and Fields 35 (2), 259-265",32,2004
"Effects of surface anisotropy and vacancies in ferromagnetic nanoparticlesJ Restrepo, Y Labaye, L Berger, JM Greneche
Journal of magnetism and magnetic materials 272, 681-682",22,2004
"The Talbot array illuminator: imaging properties and a new interpretationA Kolodziejczyk, Z Jaroszewicz, R Henao, O Quintero
Journal of Optics A: Pure and Applied Optics 6 (6), 651",7,2004
"Exploring the sub-eV neutrino mass range with supernova neutrinosE Nardi, JI Zuluaga
Physical Review D 69 (10), 103002",9,2004
"The effect of water content on the magnetic and structural properties of goethiteJD Betancur, CA Barrero, JM Greneche, GF Goya
Journal of alloys and compounds 369 (1), 247-251",19,2004
"SU (3) c⊗ SU (4) L⊗ U (1) X without exotic electric chargesWA Ponce, DA Gutiérrez, LA Sánchez
Physical Review D 69 (5), 055007",42,2004
"Measuring neutrino masses with supernova neutrinosE Nardi
arXiv preprint astro-ph/0401624",,2004
"Stress effects on shallow-donor impurity states in symmetrical G a A s/A l x Ga 1− x As double quantum wellsN Raigoza, AL Morales, A Montes, N Porras-Montenegro, CA Duque
Physical Review B 69 (4), 045323",134,2004
"Echeverr! ıa, G. 377 Elbaile, L. 183 Ellena, J. 377 Errico, LA 338 Est! evez-Rams, E. 88M Abbate, C Acha, JA Aguiar, F Aguilera-Granja, C Albornoz, P Allongue, ...
Physica B 354, 381-383",,2004
"FATIGA EN CONDENSADORES FERROELECTRICOS DE PZT CON DIFERENTES ELECTRODOSJ Osorio, P Prieto
REVISTA COLOMBIANA DE FÍSICA 36 (1)",,2004
"CÁLCULO DE ε Y n DEL ALUMINIO A PARTIR DE MEDIDAS DE REFLECTANCIAJ Osorio, FJ Molina, O Arnache, JC Castrillón, DGG Pérez
REVISTA COLOMBIANA DE FÍSICA 36 (2)",,2004
"Superfluidity and superconductivity-In-plane electrodynamics of the superconductivity in Bi2Sr2CaCu2O8+ d: Energy scales and spectral weight distributionAF Santander-Syro, R Lobo, N Bontemps, W Lopera, D Girata, ...
Physical Review-Section B-Condensed Matter 70 (13), 134504-134504",,2004
"b–τ Yukawa non-unification in supersymmetric SU (5) with an Abelian flavor symmetryD Aristizabal, E Nardi
Physics Letters B 578 (1), 176-180",5,2004
"LA CIENCIA DE SIMULAR PROPIEDADES DE MATERIALESÁL Morales
Revistas de la Academia Colombiana de Ciencias Exactas, Físicas y Naturales ...",2,2004
"CARACTERIZACIÓN DE HEMATITAS DOPADAS CON Zn OBTENIDAS A PAR-TIR DE OXINATOS DE Fe-Zn TRATADOS TÉRMICAMENTE.JE Hamann, G Pérez, CA Barrero, AL Morales, GM Da Costa
REVISTA COLOMBIANA DE FÍSICA 36 (2)",,2004
"Monte Carlo simulation of the self-assembly process of nonionic surfactants (type HXTY) considering second-neighbor interaction between surfactant moleculesC PEREZ ZAPATA, H CASANOVA, J RESTREPO
Progress in colloid & polymer science, 146-150",1,2004
"Monte Carlo simulation of the self-assembly process of nonionic surfactants (type H X T Y) considering second-neighbor interaction between surfactant moleculesCP Zapata, H Casanova, J Restrepo
Surface and Colloid Science, 146-150",2,2004
"Self-Assembly and Structured Fluids-Monte Carlo simulation of the self-assembly process of nonionic surfactants (type HXTY) considering second-neighbor interaction between surfactant moleculesCP Zapata, H Casanova, J Restrepo
Progress in Colloid and Polymer Science 128, 146-150",,2004
"Elastic properties of Mg~(~ 1~-~ x~) Al~ xB~ 2 from first principles theoryJM Osorio-Guillen, P Souvatzis
Journal of physics: Condensed matter, 5241-5250",,2004
"RESONANT STATES IN ATOMIC PHYSICS II: CSCI APPROACH IN NEGATIVE IONSJL Sanz-Vicario, JCC Gómez
REVISTA COLOMBIANA DE FÍSICA 36 (2)",,2004
"RESONANT STATES IN ATOMIC PHYSICS I: SIMPLE MODELSJL Sanz-Vicario, JCC Gómez
REVISTA COLOMBIANA DE FÍSICA 36 (2)",,2004
"Semiconductors II: Surfaces, interfaces, microstructures, and related topics-Stress effects on shallow-donor impurity states in symmetrical GaAs/AlxGa1-xAs double quantum wellsN Raigoza, AL Morales, A Montes, N Porras-Montenegro, CA Duque
Physical Review-Section B-Condensed Matter 69 (4), 45323-45323",,2004
"CARACTERIZACIÓN DE ESTADOS DE POLARIZACIÓNE Rueda, R Henao
REVISTA COLOMBIANA DE FÍSICA 36 (2)",,2004
"AUTOIMÁGENES EN FRAUNHOFER-FRESNELJF Barrera, R Henao, C Osorio, F Medina
REVISTA COLOMBIANA DE FÍSICA 36 (1)",,2004
"EL PRINCIPIO DE MAUPERTUIS. UN ENSAYO PARA UNA ACADEMIAWA Ponce
Revista de la Academia Colombiana de Ciencias 28 (108), 363-369",,2004
"Exciton trapping in interface defects/quantum dots in narrow quantum wells: magnetic-field effectsZ Barticevic, M Pacheco, CA Duque, LE Oliveira
Physica B: Condensed Matter 340, 1090-1093",,2003
"Síntesis y caracterización Mössbauer de magnetitas dopadas con Cu y CrCA Barrero, AL Morales, J Mazo-Zuloaga, F Jaramillo, G Pérez, ...
Revista de Metalurgia 39 (Extra), 62-67",,2003
"Simulación de los procesos de corrosión atmosférica durante largos períodos de tiempo de un acero autoprotector y ordinarioF Bolivar, A Morales, C Arroyave
Revista de Metalurgia 39 (Extra), 265-269",,2003
"Estudio por difracción de rayos X de los productos de corrosión del acero al carbonoAL Morales
Revista de Metalurgia 39 (Extra), 28-31",,2003
"Óxidos de hierro relacionados con la corrosión: hematitas dopadas con Cu, Mn y CrG Pérez, C Barrero, A Morales, J Tobon, O Garnache, C Rodríguez, ...
Revista de Metalurgia 39 (Extra), 68-71",,2003
"Double charge exchange and configuration mixingHC Wu, WR Gibbs
Physical Review C 68 (5), 054610",3,2003
"Optical properties of the phase sampling filterA Kolodziejczyk, Z Jaroszewicz, RH Henao, O Quintero
Proceedings of SPIE 5259, 82",,2003
