Article,Cites,Year
"Nonlinear optical response in a zincblende GaN cylindrical quantum dot with donor impurity centerJH Hoyos, JD Correa, ME Mora-Ramos, CA Duque
Physica B: Condensed Matter 484, 73-82",,2016
"Localization properties of photonic modes in disordered nonlinear-Kerr/metamaterial heterostructuresE Reyes-Gómez, SB Cavalcanti, LE Oliveira
Superlattices and Microstructures 90, 1-7",,2016
"Multi-fractal analysis and lacunarity spectrum of the dark matter haloes in the SDSS-DR7CA Chacón-Cardona, RA Casas-Miranda, JC Muñoz-Cuartas
Chaos, Solitons & Fractals 82, 22-33",,2016
"Diboson anomaly: heavy Higgs resonance and QCD vectorlike exoticsD Aristizabal-Sierra, J Herrero-Garcia, D Restrepo, A Vicente
Physical Review D 93 (1), 015012",4,2016
"Fermion dark matter from SO (10) GUTsC Arbeláez, R Longas, D Restrepo, O Zapata
Physical Review D 93 (1), 013012",2,2016
"Inert extension of the Zee modelR Longas
Nuclear and Particle Physics Proceedings 267, 342-344",,2015
"Effects of features in the inflaton potential on the spectrum and bispectrum of primordial curvature perturbationsAG Cadavid, AE Romano
Nuclear and Particle Physics Proceedings 267, 254-256",,2015
"Zero-ϕ eff non-Bragg gap solitons in 1D Kerr polaritonic/metamaterial heterostructuresE Reyes-Gómez, SB Cavalcanti, LE Oliveira
Physica E: Low-dimensional Systems and Nanostructures",,2015
"A model with a viable dark matter candidate and massive neutrinosD Restrepo, A Rivera, M Sánchez, O Zapata
Nuclear and Particle Physics Proceedings 267, 367-369",,2015
"The assignment of Lepton number and neutrino masses in 3-3-1 modelsRH Benavides, WA Ponce
Nuclear and Particle Physics Proceedings 267, 370-375",,2015
"Slow light in semiconductor quantum dots: Effects of non-Markovianity and correlation of dephasing reservoirsD Mogilevtsev, E Reyes-Gómez, SB Cavalcanti, LE Oliveira
Physical Review B 92 (23), 235446",,2015
"A search for the ground state structure and the phase stability of tantalum pentoxideS Pérez-Walton, C Valencia-Balvín, ACM Padilha, GM Dalpian, ...
Journal of Physics: Condensed Matter 28 (3), 035801",,2015
"Multiband electronic characterization of the complex intermetallic cage system Y 1− x Gd x Co 2 Zn 20M Cabrera-Baez, A Naranjo-Uribe, JM Osorio-Guillén, C Rettori, MA Avila
Physical Review B 92 (21), 214414",,2015
"Effects of discontinuities of the derivatives of the inflaton potentialAG Cadavid, AE Romano
The European Physical Journal C 75 (12), 1-16",,2015
"Optical absorption and refractive index changes in a semiconductor quantum ring: Electric field and donor impurity effectsRE Acosta, AL Morales, CM Duque, ME Mora‐Ramos, CA Duque
physica status solidi (b)",,2015
"Complex magnetic states in Ni/Fe bi‐segmented nanorodsJ Mejía‐López, EA Velásquez, S López‐Moreno, J Mazo‐Zuluaga
physica status solidi (RRL)-Rapid Research Letters 9 (12), 740-744",,2015
"Papers submitted to the 16th International Conference on the Physics of Light-Matter Coupling in Nanostructures, PLMCN 2015 (Medellín, Colombia)A Nalitov, A Kavokin, CA Duque
Superlattices and Microstructures 87, 1-4",,2015
"X-ray magnetic circular dichroism on La 2/3 Ca 1/3 Mn 0.97 Fe 0.03 O 3 thin filmsAI Figueroa, GE Campillo, AA Baker, JA Osorio, OL Arnache, ...
Superlattices and Microstructures 87, 42-46",1,2015
"A meshless scheme for the calculation of electron and hole states in laterally coupled GaAs–Ga 1− x Al x As quantum dots under applied electric fieldMA Londoño, JH Rúa, JD Giraldo-Gómez, H Montegranario, ...
Superlattices and Microstructures 87, 77-82",1,2015
"Study of electron-related intersubband optical properties in three coupled quantum wells wires with triangular transversal sectionA Tiutiunnyk, V Tulupenko, V Akimov, R Demediuk, AL Morales, ...
Superlattices and Microstructures 87, 131-136",1,2015
"Intense laser field effects on a Woods–Saxon potential quantum wellRL Restrepo, AL Morales, V Akimov, V Tulupenko, E Kasapoglu, F Ungan, ...
Superlattices and Microstructures 87, 143-148",1,2015
"The formation of indirect excitons in atomic layer doped systemsME Mora-Ramos, CA Duque
Superlattices and Microstructures 87, 32-37",1,2015
"The polaritonic spectrum of two-dimensional photonic crystals based on uniaxial polar materialsHA Gómez-Urrea, CA Duque, ME Mora-Ramos
Superlattices and Microstructures 87, 58-63",1,2015
"Intersubband linear and nonlinear optical response of the delta-doped SiGe quantum wellCA Duque, V Akimov, R Demediuk, V Belykh, A Tiutiunnyk, AL Morales, ...
Superlattices and Microstructures 87, 125-130",1,2015
"Electronic and thermal properties of Biphenyl moleculesFG Medina, JH Ojeda, CA Duque, D Laroze
Superlattices and Microstructures 87, 89-96",1,2015
"Electron-related Raman scattering in dilute nitride GaAs/In x Ga 1− x N y As 1− y cylindrically shaped quantum dotsCM Duque, AL Morales, CA Duque, ME Mora-Ramos
Superlattices and Microstructures 87, 83-88",1,2015
"The phonon-polariton spectrum of one-dimensional Rudin–Shapiro photonic superlattices with uniaxial polar materialsHA Gómez-Urrea, CA Duque, ME Mora-Ramos
Superlattices and Microstructures 87, 115-119",,2015
"Donor-impurity-related second and third harmonic generation and optical absorption in GaAs-(Ga, Al) As 3D coupled quantum dot-rings under applied electric fieldCA Duque, ME Mora-Ramos, JD Correa
Superlattices and Microstructures 87, 25-31",1,2015
"Optical properties of a multibarrier structure under intense laser fieldsDA Ospina, V Akimov, ME Mora-Ramos, AL Morales, V Tulupenko, ...
Superlattices and Microstructures 87, 109-114",1,2015
"About possible THz modulator on the base of delta-doped QWsCA Duque, V Akimov, R Demediuk, V Belykh, A Tiutiunnyk, AL Morales, ...
Superlattices and Microstructures 87, 5-11",2,2015
"Propiedades ópticas de impurezas donadoras en anillos cuánticos sometidos a los efectos combinados de campo eléctrico y radiación láser intensa no resonanteCA Duque, Á Morales, M Mora-Ramos
Revista de la Academia Colombiana de Ciencias Exactas, Físicas y Naturales ...",,2015
"Design of Super-Paramagnetic Core–Shell Nanoparticles for Enhanced Performance of Inverted Polymer Solar CellsJ Jaramillo, BW Boudouris, CA Barrero, F Jaramillo
ACS applied materials & interfaces 7 (45), 25061-25068",1,2015
"Theoretical methods for attosecond electron and nuclear dynamics: applications to the H2 moleculeA Palacios, JL Sanz-Vicario, F Martín
Journal of Physics B: Atomic, Molecular and Optical Physics 48 (24), 242001",,2015
"¿ Y qué es lo que vemos?RH Henao
Revista Experimenta",,2015
"Correlation between vacancies and magnetoresistance changes in FM manganites using the Monte Carlo methodJD Agudelo-Giraldo, E Restrepo-Parra, J Restrepo
Journal of Magnetism and Magnetic Materials 391, 129-135",,2015
"A systematic first‐principles study of the tungsten trioxide polymorphsJC Alvarez‐Quiceno, GM Dalpian, JM Osorio‐Guillén
physica status solidi (b) 252 (10), 2290-2295",,2015
"The effects of the intense laser field on the nonlinear optical properties of a cylindrical Ga 1− x Al x As/GaAs quantum dot under applied electric fieldE Kasapoglu, CA Duque, ME Mora-Ramos, I Sökmen
Physica B: Condensed Matter 474, 15-20",1,2015
"Autocorrelation measurement of an ultra-short optical pulse using an electrically focus-tunable lensJ Serna, A Hamad, E Rueda, H Garcia
Journal of Optics 17 (10), 105505",,2015
"Computational Physics: Problem Solving with PythonRH Landau, MJ PÃ, CC Bordeianu
John Wiley & Sons",225,2015
"Assessing photocatalytic power of g-C3N4 for solar fuel production: A first-principles study involving quasi-particle theory and dispersive forcesJM Osorio-Guillén, WF Espinosa-García, CM Araujo
The Journal of chemical physics 143 (9), 094705",2,2015
"Probing the role of the galactic environment in the formation of stellar clusters, using M83 as a test benchA Adamo, JMD Kruijssen, N Bastian, E Silva-Villa, J Ryon
Monthly Notices of the Royal Astronomical Society 452 (1), 246-260",7,2015
"Donor impurity states and related optical response in a lateral coupled dot-ring system under applied electric fieldJD Correa, ME Mora-Ramos, CA Duque
Physica B: Condensed Matter 472, 25-33",2,2015
"Non-linear optical processes involving excited subbands in laser-dressed quantum wires with triangular cross-sectionA Radu, CA Duque
Physica E: Low-dimensional Systems and Nanostructures 72, 165-177",3,2015
"An Investigation of Circumbinary Planet Orbital Stability and Habitability to Identify Potential Planetary Systems with Several Habitable PlanetsPA Mason, J Zuluaga, PA Cuartas
IAU General Assembly 22, 56024",,2015
"Optimized and secure technique for multiplexing QR code images of single characters: application to noiseless messages retrievalS Trejos, JF Barrera, R Torroba
Journal of Optics 17 (8), 085702",,2015
"On intersubband absorption of radiation in delta-doped QWsV Tulupenko, CA Duque, V Akimov, R Demediuk, V Belykh, A Tiutiunnyk, ...
Physica E: Low-dimensional Systems and Nanostructures 74, 400-406",2,2015
"Sustainability of Transient Kinetic Regimes and Origins of DeathDY Zubarev, LA Pachón
arXiv preprint arXiv:1507.06160",,2015
"One-step reconstruction of assembled 3D holographic scenesAV Zea, JF Barrera-Ramírez, R Torroba
Optics & Laser Technology 75, 146-150",1,2015
"Radiative neutrino masses in the singlet-doublet fermion dark matter model with scalar singletsD Restrepo, A Rivera, M Sánchez-Peláez, O Zapata, W Tangarife
Physical Review D 92 (1), 013005",9,2015
"Constraints on Circumbinary HabitabilityPA Mason, JI Zuluaga, AG Zhilkin, DV Bisikalo, PA Cuartas-Restrepo
Living Together: Planets, Host Stars and Binaries 496, 405",,2015
"La evolución de la físicaG Pineda
Revista Universidad de Antioquia",,2015
"Circumbinary habitability nichesPA Mason, JI Zuluaga, PA Cuartas-Restrepo, JM Clark
International Journal of Astrobiology 14 (03), 391-400",1,2015
"La conceptualización del campo eléctrico y magnético. Análisis de las concepciones de los estudiantesBEO Velez, JA Osorio, LS Mejía, GE Campillo, R Covaleda
Revista CINTEX 20 (1)",,2015
"Non-Bragg-gap solitons in one-dimensional Kerr-metamaterial Fibonacci heterostructuresE Reyes-Gómez, SB Cavalcanti, LE Oliveira
Physical Review E 91 (6), 063205",,2015
"Psychophysical evaluation of the light sword optical element (LSOE) without axial symmetry for presbyopia compensationW Torres, A Mira, JF Barrera, R Henao, A Kolodziejczyk
Investigative Ophthalmology & Visual Science 56 (7), 2981-2981",,2015
"Quantum process tomography by 2D fluorescence spectroscopyLA Pachón, AH Marcus, A Aspuru-Guzik
The Journal of chemical physics 142 (21), 212442",,2015
"The Aristarchus Campaigns: Collaboratively measuring the Solar SystemJI Zuluaga, JC Figueroa
A Global Audience for the New Race to the Moon, 23",,2015
"Nonlinear optical rectification and second-harmonic generation in a semi-parabolic quantum well under intense laser field: Effects of electric and magnetic fieldsF Ungan, JC Martínez-Orozco, RL Restrepo, ME Mora-Ramos, ...
Superlattices and Microstructures 81, 26-33",13,2015
"Graphene samples preparation and some possible uses in developing optical communication devicesJDZ Caro, AMC Soto, RH Henao, EAT de Souza
Revista Facultad de Ingeniería, 108-117",,2015
"Alternative $ Z'$ Bosons in $ E_6$E Rojas, J Erler
arXiv preprint arXiv:1505.03208",,2015
"Galaxy Cluster Mass Reconstruction Project–II. Quantifying scatter and bias using contrasting mock cataloguesL Old, R Wojtak, GA Mamon, RA Skibba, FR Pearce, D Croton, S Bamford, ...
Monthly Notices of the Royal Astronomical Society 449 (2), 1897-1920",13,2015
"Studying the YMC population of M83: how long clusters remain embedded, their interaction with the ISM and implications for GC formation theoriesK Hollyhead, N Bastian, A Adamo, E Silva-Villa, J Dale, JE Ryon, Z Gazak
Monthly Notices of the Royal Astronomical Society 449 (1), 1106-1117",14,2015
"Assessment of imaging with extended depth-of-field by means of the light sword lens in terms of visual acuity scaleK Kakarenko, I Ducin, K Grabowiecki, Z Jaroszewicz, A Kolodziejczyk, ...
Biomedical optics express 6 (5), 1738-1748",,2015
"Mapping and Controlling Ultrafast Dynamics of Highly Excited D2+ by Attosecond XUV RadiationP Ranitovic, C Hogle, L Martin, RY Bello, A Palacios, JL Sanz-Vicario, ...
APS Division of Atomic, Molecular and Optical Physics Meeting Abstracts 1, 4005",,2015
"Information and entanglement measures applied to the analysis of complexity in doubly excited states of heliumJPR Cuartas, JL Sanz-Vicario
Physical Review A 91 (5), 052301",5,2015
"Electron-related optical properties in T-shaped AlxGa1− xAs/GaAs quantum wires and dotsJC Martínez-Orozco, ME Mora-Ramos, CA Duque
The European Physical Journal B 88 (5), 1-9",,2015
"Bridging the gap between discrete and continuous magnetic models in the scaling approachEA Velásquez, J Mazo-Zuluaga, P Vargas, J Mejía-López
Physical Review B 91 (13), 134418",,2015
"A novel method for identifying exoplanetary ringsJI Zuluaga, DM Kipping, M Sucerquia, JA Alvarado
The Astrophysical Journal Letters 803 (1), L14",6,2015
"La enseñanza y el aprendizaje del electromagnetismo: una breve revisión de las investigaciones en este campoBE Osorio, JA Osorio, LE Mejía, GE Campillo, R Covaleda
Revista CINTEX 17",1,2015
"Electromagnetically-Induced Frame-Dragging around Astrophysical ObjectsAFG Ruiz, LA Pachón
arXiv preprint arXiv:1504.01763",,2015
"High‐pressure effects on the intersubband optical absorption coefficient and relative refractive index change in an asymmetric double δ‐doped GaAs quantum wellKA Rodríguez‐Magdaleno, JC Martínez‐Orozco, I Rodríguez‐Vargas, ...
physica status solidi (b) 252 (4), 683-688",,2015
"Exciton‐related optical properties in zinc‐blende GaN/InGaN quantum wells under hydrostatic pressureCM Duque, AL Morales, ME Mora‐Ramos, CA Duque
physica status solidi (b) 252 (4), 670-677",,2015
"Shallow‐impurity‐related binding energy and linear optical absorption in ring‐shaped quantum dots and quantum‐well wires under applied electric fieldSAA Kohl, RL Restrepo, ME Mora‐Ramos, CA Duque
physica status solidi (b) 252 (4), 786-794",1,2015
"Quantum limit for driven linear non-Markovian open-quantum-systemsAF Estrada, LA Pachón
New Journal of Physics 17 (3), 033038",13,2015
"Searches for light-and heavy-flavour three-jet resonances in pp collisions at s= 8 TeVH Pieta, S Thüer, M Weber, D Bloch, F Drouhin, P Juillot, N Beaupere, ...
Elsevier",,2015
"Combined effects of intense laser field, electric and magnetic fields on the nonlinear optical properties of the step-like quantum wellE Kasapoglu, CA Duque, ME Mora-Ramos, RL Restrepo, F Ungan, ...
Materials Chemistry and Physics 154, 170-175",1,2015
"LHC constraints on 3-3-1 modelsC Salazar, RH Benavides, WA Ponce, E Rojas
arXiv preprint arXiv:1503.03519",4,2015
"Lepton number violation and neutrino masses in 3-3-1 modelsRH Benavides, LN Epele, H Fanchiotti, C García Canal, WA Ponce
Advances in High Energy Physics 2015",,2015
"No evidence for significant age spreads in young massive LMC clustersF Niederhofer, M Hilker, N Bastian, E Silva-Villa
Astronomy & Astrophysics 575, A62",14,2015
"Effect of wavelength on metrological characteristics of non-holographic fiber specklegram sensorVH Aristizabal, A Hoyos, E Rueda, ND Gomez, JA Gomez
Photonic Sensors 5 (1), 1-5",,2015
"On some new effects in delta-doped QWsV Tulupenko, CA Duque, R Demediuk, V Belykh, A Tiutiunnyk, ...
Physica E: Low-dimensional Systems and Nanostructures 66, 162-169",2,2015
"Directional dependence of the local estimation of H0 and the nonperturbative effects of primordial curvature perturbationsAE Romano, SA Vallejo
EPL (Europhysics Letters) 109 (3), 39002",1,2015
"Generation of optical vortices by using binary vortex producing lensesN Londoño, E Rueda, JA Gómez, A Lencina
Applied optics 54 (4), 796-801",2,2015
"The effects of intense laser field and applied electric and magnetic fields on optical properties of an asymmetric quantum wellRL Restrepo, F Ungan, E Kasapoglu, ME Mora-Ramos, AL Morales, ...
Physica B: Condensed Matter 457, 165-171",1,2015
"Sizes and Shapes of Young, Massive Star Clusters in M83JE Ryon, N Bastian, A Adamo, E Silva-Villa, JS Gallagher
American Astronomical Society Meeting Abstracts 225",,2015
"How well can we measure galaxy cluster masses using galaxies as tracers?L Old, RA Skibba, F Pearce, D Croton, S Muldrew, JC Munoz-Cuartas, ...
American Astronomical Society Meeting Abstracts 225",,2015
"Molecular structure of one-electron diatomic molecules subject to plasma screening and its effect on the dynamicsAF Ordóñez-Lasso, JL Sanz-Vicario, F Martín
Journal of Physics: Conference Series 635 (7), 072084",,2015
"Mapping ultrafast dynamics of highly excited D2+ by ultrashort XUV pump-IR probe radiationR Bello, LS Martin, CW Hogle, A Palacios, JL Sanz-Vicario, XM Tong, ...
Journal of Physics: Conference Series 635 (11), 112080",,2015
"Plasma screening effects in molecular hydrogen: modified energies and lifetimes of doubly excited statesAF Ordóñez-Lasso, JL Sanz-Vicario, F Martín
Journal of Physics: Conference Series 635 (7), 072026",,2015
"Refraction index modulation induced with transverse electric field in double tunnel-coupled GaAs/AlGaAs quantum wellsAA Shumilov, MY Vinnichenko, RM Balagula, LE Vorobjev, DA Firsov, ...
Journal of Physics: Conference Series 643 (1), 012076",,2015
"High Pressure in Semiconductor PhysicsME Mora-Ramos, CA Duque
Phys. Status Solidi B 252 (4), 645-648",,2015
"Habitability of Planets Orbiting Binaries Consisting of Solar Mass TwinsPA Mason, JI Zuluaga, AG Zhilkin, DV Bisikalo
American Astronomical Society Meeting Abstracts 225",,2015
"Mineralogical Characterization of Chalcopyrite BioleachingER Mejía, JD Ospina, L Osorno, MA Márquez, AL Morales",,2015
"Understanding the role of iron in the magnetism of Fe doped ZnO nanoparticlesJJ Beltrán, CA Barrero, A Punnoose
Physical Chemistry Chemical Physics 17 (23), 15284-15296",2,2015
"Measurement of nonlinear optical Absorption and non-linear optical refraction in CdS and ZnSe using an electrically focus-tunable lensJ Serna, A Hamad, H Garcia, E Rueda
International Conference on Fibre Optics and Photonics, T2C. 2",,2014
"Impurity-related nonlinear optical properties in delta-doped quantum rings: Electric field effectsRL Restrepo, AL Morales, JC Martínez-Orozco, HM Baghramyan, ...
Physica B: Condensed Matter 453, 140-145",4,2014
"The effect of spatial resolution on optical and near-IR studies of stellar clusters: implications for the origin of the red excessN Bastian, A Adamo, M Schirmer, K Hollyhead, Y Beletsky, G Carraro, ...
Monthly Notices of the Royal Astronomical Society 444 (4), 3829-3836",4,2014
"Nonlinear optical properties of bulk cuprous oxide using single beam Z-scan at 790 nmJ Serna, E Rueda, H García
Applied Physics Letters 105 (19), 191902",,2014
"Direct experimental determination of spectral densities of molecular complexesLA Pachón, P Brumer
The Journal of chemical physics 141 (17), 174102",7,2014
"Alonso Sepúlveda: Carta astral de un escépticoAR Jiménez
Revista Universidad de Antioquia",,2014
"Synchronization in a semiclassical Kuramoto modelIH de Mendoza, LA Pachón, J Gómez-Gardeñes, D Zueco
Physical Review E 90 (5), 052904",9,2014
"Synchronization in a semiclassical Kuramoto modelIH de Mendoza, LA Pachón, J Gómez-Gardeñes, D Zueco
Physical Review E 90 (5), 052904",9,2014
"Electron-related linear and nonlinear optical responses in vertically coupled triangular quantum dotsJC Martínez-Orozco, ME Mora-Ramos, CA Duque
Physica B: Condensed Matter 452, 82-91",8,2014
"Exciton-related nonlinear optical response and photoluminescence in dilute nitrogen InxGa1− xNyAs1− y/GaAs cylindrically shaped quantum dotsCM Duque, AL Morales, ME Mora-Ramos, CA Duque
Journal of Luminescence 154, 559-568",7,2014
"¿ Es posible divulgar la ciencia?G Pineda
Revista Universidad de Antioquia",,2014
"Circular dichroism in molecular-frame photoelectron angular distributions in the dissociative photoionization of H 2 and D 2 moleculesJF Pérez-Torres, JL Sanz-Vicario, K Veyrinas, P Billaud, YJ Picard, ...
Physical Review A 90 (4), 043417",4,2014
"Quantum nonlinear optics with polar J-aggregates in microcavitiesF Herrera, B Peropadre, LA Pachon, SK Saikin, A Aspuru-Guzik
The journal of physical chemistry letters 5 (21), 3708-3715",5,2014
"Tidal, thermal and magnetic evolution of terrestrial exoplanets in the habitable zone of dwarf starsP Cuartas-Restrepo, M Melita, J Zuluaga, J Hoyos, M Sucerquia
Revista Mexicana de Astronomia y Astrofisica Conference Series 44, 130-130",,2014
"Impurity binding energy for δ-doped quantum well structuresV Tulupenko, CA Duque, R Demediuk, O Fomina, V Akimov, V Belykh, ...
Bulletin of Materials Science 37 (6), 1347-1351",,2014
"Three predictions: Comet 67P/Churyumov–Gerasimenko, comet C/2012 K1 PANSTARRS, and comet C/2013 V5 OukaimedenI Ferrín
Planetary and Space Science 99, 171-175",,2014
"Donor impurity states and related optical responses in triangular quantum dots under applied electric fieldE Kasapoglu, F Ungan, H Sari, I Sökmen, ME Mora-Ramos, CA Duque
Superlattices and Microstructures 73, 171-184",19,2014
"Donor-impurity related photoionization cross section in GaAs/Ga1− xAlxAs concentric double quantum rings: Effects of geometry and hydrostatic pressureHM Baghramyan, MG Barseghyan, AA Kirakosyan, D Laroze, CA Duque
Physica B: Condensed Matter 449, 193-198",2,2014
"Formation, habitability, and detection of extrasolar moonsR Heller, D Williams, D Kipping, MA Limbach, E Turner, R Greenberg, ...
Astrobiology 14 (9), 798-835",24,2014
"Shot noise and thermopower in aromatic moleculesJH Ojeda, CA Duque, D Laroze
Physica E: Low-dimensional Systems and Nanostructures 62, 15-20",2,2014
"Experimental scrambling and noise reduction applied to the optical encryption of QR codesJF Barrera, A Vélez, R Torroba
Optics express 22 (17), 20268-20277",10,2014
"The location of Oort Cloud comets C/2011 L4 Panstarrs and C/2012 S1 ISON on a comet evolutionary diagramI Ferrín
Monthly Notices of the Royal Astronomical Society 442 (2), 1731-1754",6,2014
"The effects of the electric and magnetic fields on the nonlinear optical properties in the step-like asymmetric quantum wellE Kasapoglu, F Ungan, CA Duque, U Yesilgul, ME Mora-Ramos, H Sari, ...
Physica E: Low-dimensional Systems and Nanostructures 61, 107-110",6,2014
"Relevance of various Dirac covariants in hadronic Bethe-Salpeter wave functions in electromagnetic decays of ground state vector mesonsS Bhatnagar, J Mahecha, Y Mengesha
Physical Review D 90 (1), 014034",8,2014
"Physical properties of quasi-one-dimensional MgO and Fe 3 O 4-based nanostructuresJ Mejia-Lopez, J Mazo-Zuluaga, S López-Moreno, F Munoz, LF Duque, ...
Physical Review B 90 (3), 035411",2,2014
"FIMP realization of the scotogenic modelE Molinaro, CE Yaguna, O Zapata
Journal of Cosmology and Astroparticle Physics 2014 (07), 015",12,2014
"The impending demise of comet C/2012 S1 (ISON)I Ferrín
Planetary and Space Science 96, 114-119",6,2014
"Effects of applied lateral electric field and hydrostatic pressure on the intraband optical transitions in a GaAs/Ga1− xAlxAs quantum ringAK Manaselyan, MG Barseghyan, AA Kirakosyan, D Laroze, CA Duque
Physica E: Low-dimensional Systems and Nanostructures 60, 95-99",6,2014
"Electron-related optical responses in triangular quantum dotsA Tiutiunnyk, V Tulupenko, ME Mora-Ramos, E Kasapoglu, F Ungan, ...
Physica E: Low-Dimensional Systems and Nanostructures 60, 127-132",35,2014
"Reply to comment on ‘Time-resolved resonant photoionization of He using a time-dependent Feshbach method with ultrashort laser pulses’CM Granados-Castro, JL Sanz-Vicario
Journal of Physics B: Atomic, Molecular and Optical Physics 47 (13), 138002",,2014
"Non-perturbative effects of primordial curvature perturbations on the apparent value of a cosmological constantAE Romano, SS Negrete, M Sasaki, AA Starobinsky
EPL (Europhysics Letters) 106 (6), 69002",10,2014
"Galaxy cluster mass reconstruction project–I. Methods and first results on galaxy-based techniquesL Old, RA Skibba, FR Pearce, D Croton, SI Muldrew, JC Muñoz-Cuartas, ...
Monthly Notices of the Royal Astronomical Society 441 (2), 1513-1536",18,2014
"States of an on-axis two-hydrogenic-impurity complex in concentric double quantum ringsM R-Fulla, JH Marín, YA Suaza, CA Duque, ME Mora-Ramos
Physics Letters A 378 (30), 2297-2302",,2014
"Donor impurity states and related terahertz range nonlinear optical response in GaN cylindrical quantum wires: Effects of external electric and magnetic fieldsJD Correa, ME Mora-Ramos, CA Duque
Journal of Applied Physics 115 (21), 213105",5,2014
"Evidence of Ferromagnetic Signal Enhancement in Fe and Co Codoped ZnO Nanoparticles by Increasing Superficial Co3+ ContentJJ Beltrán, CA Barrero, A Punnoose
The Journal of Physical Chemistry C 118 (24), 13203-13217",7,2014
"Electromagnetic energy transport in finite photonic structuresM de Dios-Leyva, CA Duque, JC Drake-Pérez
Optics express 22 (11), 12760-12772",,2014
"Engineering iron oxide nanoparticles for biomedicine and bioengineering applicationsJP Urquijo, H Casanova, AL Morales
Revista Facultad de Ingeniería Universidad de Antioquia, 230-243",1,2014
"A new method to determine large scale structure from the luminosity distanceAE Romano, HW Chiang, P Chen
Classical and Quantum Gravity 31 (11), 115008",1,2014
"The simplest method to measure the geocentric lunar distance: a case of citizen scienceJI Zuluaga, JC Figueroa, I Ferrin
arXiv preprint arXiv:1405.4580",1,2014
"Experimental QR code optical encryption: noise-free data recoveringJF Barrera, A Mira-Agudelo, R Torroba
Optics letters 39 (10), 3074-3077",13,2014
